,author,id,selftext,subreddit,title
928,Jamesthe84,eqiwr4,[removed],history,Dont you wish we knew the homicide rate in ancient Rome
929,notmyhusband,eqits9,[removed],history,Can anyone rally behind my desire to see the Lewis and Clark expedition in major motion film
930,Chicken-Inspector,eqih0c,[removed],history,Looking for a book on Japanese history spanning the whole history of the nation
933,hiteshhedwig,eqhpk0,[removed],history,What were some top propaganda in the history of propaganda
935,hiteshhedwig,eqh8ny,[removed],history,What were some top fake news in the history of fake news
936,GravyBear8,eqh5dq,[removed],history,Books on the Anarchy in England
937,TheScoutReddit,eqgw30,[removed],history,Whats the consensus on pederasty in Ancient Greece
938,Bartimaus666,eqgul5,[removed],history,How often have the British islands been invaded by other people groups
943,alansshots,eqg2i8,[removed],history,Hi everyoneDoes anyone know the reason why the Berlin wall was buildAnd from what they wanted to protect them selves Im student and need to write on this topic
947,tupperware690,eqfp1r,[removed],history,What was the response to the discovery of dinosaur fossils in the UK
950,WisdomDistiller,eqe8zr,[removed],history,Were there any groups in history who actually identified as the bad guys rather than just doing horrible things for internally justified/rightous reasons Real life Darkfriends
957,Gruel_Consumption,eqcvio,[removed],history,Common Conceptions on Vietnam
958,sargentspliff,eqcny4,[removed],history,Who was the last pope to call for a crusade
959,MIGA2020,eqbu4k,[removed],history,Pharaoh and Moses
961,ObberGobb,eqbc9v,[removed],history,How were the World Wars named
962,brockoli117,eqb15e,[removed],history,When were the cardinal directions implemented and what was used before them
963,starwarsnoyodayup,eqawle,[removed],history,Recommended widespanning sources any literary audio film
964,Vroomped,eqatwr,[removed],history,Historical context of the KKK
965,GermanSherman69,eqa9ug,[removed],history,German Conscription and Communism
967,killerbutton,eqa3qf,[removed],history,Why is one of the largest migrations of humans in world history the white flight emigration from Americas urban centers to newly built suburbs just completely ignored at a historical level and in the mainstream media
968,grimsituation6,eq9ssq,[removed],history,Christian pilgrims the result of the inverse of Roman wealth
969,MindTheReddit,eq9jmg,[removed],history,Best books on aragon or catalonian Kings
970,Mqdii,eq9ioc,[removed],history,my teacher is actually streaming and giving a history lesson on the orgins of american goverment not really trying to promote anything but its nice to have listening while working on stuff
971,gaucho__marx,eq9fra,[removed],history,Why so many American films set in Paris
972,MindTheReddit,eq8zlc,[removed],history,Books on the Hungarian black army or Stephen I
975,Real_Carl_Ramirez,eq7yyz,[removed],history,Were there rules of war before the modern era
976,starwarsnoyodayup,eq7x91,[removed],history,Starting from scratch as an educated adult
977,Anglicanpolitics123,eq7vju,[removed],history,What were the circumstance that led William the Conqueror to invade England
978,dodgeriscool123,eq7n0d,[removed],history,during the Vietnam war was south Vietnam an aristocratic or autocratic society
979,HeedTheGreatFilter,eq7gpk,[removed],history,Are historians still divided over the meaning of Andrew Jacksons political war against the Bank of the United States and especially about the wisdom of obliterating it
980,Apophis41,eq7fvy,[removed],history,Which leaders though out history had the most power over their nation
981,goetterraserei,eq7foo,[removed],history,Whats that in this gentlemans hand
982,Hermaeus_Mike,eq762y,[removed],history,Linguistic Questions on Platos Republic
984,njr4t,eq6yr7,[removed],history,what is the real story behind seven sleepers
985,hannaheg,eq6ve6,[removed],history,Britains point of view on the revolutionary war
986,Choody1234,eq6hxe,[removed],history,Did pagan religions try and reform when they came into contact with Christian or Islam
987,Choody1234,eq6696,[removed],history,Is there any evidence of Pagan religions around the world trying to reform or adapt their faith maybe into a more structured religion during the times of Christian and Islamic conversion of other religions
988,Chulmardani337,eq5zmd,[removed],history,What are your thoughts on that Netflix show Jack Ryan lying about Venezuela and the cause of all its problems
989,PA7RICK911,eq5vvv,[removed],history,Did US astronauts ever meet USSR cosmonauts on the moon
990,KEVpo2016,eq5uch,[removed],history,Most violent/traumatic war for the US
992,Chulmardani337,eq4kgm,[removed],history,What are your thoughts on that Netflix show Jack Ryan lying about Venezuela and the cause of all its problems
993,Geoffistopholes,eq4e6s,[removed],history,Anniversary of the Volstead Act
999,kulturpolitik,eq352k,[removed],history,Why Cold War era politicians were so charismatic
0,russe329,evs4m9,[removed],history,What bust would/do you have in your office
1,SaltCounter6,evs0ld,[removed],history,T
2,oscar27436,evrylg,[removed],history,Religion caused WW1 and most all other wars too
3,1owen1,evrlpd,[removed],history,holocaust Video
4,Bojack_Hollyhock,evrkpf,[removed],history,Despite having a big size many natural resources and productive lands a big coast and few external wars why Brazil in 19th and early 20th centuries was not able to have a growth of his economic military and political power similar to what USA and China had
7,HunterRiess,evr7ad,[removed],history,Warren G Harding was the best president ever
8,destructor_rph,evqvkv,[removed],history,Are there any examples of cultures in history that DID NOT form a religion
9,Mithras-xx,evqs16,[removed],history,Tamerlane and Timurid Empire Ethnic Groups/Names
10,gingapelle,evqn56,[removed],history,How would Europe look if nazi Germany won the war
14,elizabxthdarcy,evpd7m,[removed],history,French History
15,Juliusx2,evp5t9,[removed],history,What kind of buttons did people wear/make in the 19th century UK
16,PR280,evoquz,[removed],history,Just thought Ill tell the story of the 1st and hopefully last assasination of an Israeli prime minister issac Rabin
19,JayColby7,evnxs1,[removed],history,Mamie Johnson First Woman Pitcher In The Negro Leagues
20,thaHaremKing,evnqjt,[removed],history,In Early Western Democracies how much percentage of men were eligible to vote
22,pluto4749,evnipf,[removed],history,Someone can do a summery of the persians wars because I have a test and Im not in a good situation with them
23,hiteshhedwig,evmwvt,[removed],history,Concentration camps in World War 2
26,oxenham1,evlqt0,[removed],history,Why didnt Sitting Bull overrun Benteens defensive position after wiping out Custers group at the Little Big Horn
28,laszlo92,evll3a,[removed],history,Why did Liechtenstein not join German unification
29,Skifer91290,evlhnl,[removed],history,Why is it that Latin  the language  is so very romanticized in modern english culture
30,KspPaul,evl2ci,[removed],history,Are there any books letters or texts from allied soldiers on the western front in 1941 
31,ivanyongweikit,evkynt,[removed],history,Napoleon and the Hearts of Men
32,Mathias_Belmont,evkj5r,[removed],history,Does the History of Science have a Eurocentric focus
33,ReviewerRandom,evju6a,[removed],history,A weird question about revolutions
34,BeatriceBernardo,evjr9i,[removed],history,Before mass schooling what is it that adolescent do
36,BeatriceBernardo,evjhwl,[removed],history,Before mass schooling what is it that adolescent do
37,cataids69,evjhdz,[removed],history,What exactly was the connection between the USSR and the DDR
38,EthanTinsley17,evj33c,[removed],history,Was there ever a pill/drug that was used that people believed would cure homosexuality
39,ArthurMorgan_dies,evj1r7,[removed],history,I just realized that it is insane that WWI and WWII even happened It is like something from fiction but actually was real
41,SeinfeldGuy2001,evivke,[removed],history,I have a question is Fidel Castro a hero or bad guy
42,NakedCallWriter,evie7j,[removed],history,What the hell was Napoleons strategic plan following his return from exile
44,Taemojitsu,evh0sj,"The leader of the republic, Enomoto Takeaki, was 32 years old.

Second-in-command was French officer Jules Brunet, aged 31.

The imperial forces that defeated them were led by Kuroda Kiyotaka, aged 28.

""Kuroda is said to have been deeply impressed by Enomoto's dedication in combat and is remembered as the one who spared the latter's life from execution.""

""In the end, the victorious imperial faction abandoned its objective to expel foreigners from Japan and instead adopted a policy of continued modernization with an eye to eventual renegotiation of the unequal treaties with the Western powers.""",history,In 1869 remnants of the shguns military established a republic on the northernmost island in Japan
45,ToastyTree69420,evh0qf,[removed],history,US History question regarding the founding fathers and interpretation of the United States Constitution
48,IrishMemer,evgouo,[removed],history,Why did Germany and Italy take so long to unify but other European powers such as Britain France Spain The Netherlands amp Russia unified so quickly in comparison
49,Person5790,evgn4h,[removed],history,What were some of Napoleons impressive military strategies
51,IrishMemer,evglpu,[removed],history,Why did it take Germany and Italy so long to unify while other European powers like Britain France Spain Russia amp the Netherlands unified so quickly in comparison
52,overtimeoroverit,evgksi,[removed],history,How historically accurate is Rise of Empires Ottomans / Rise of Empires series on Netflix
53,CampingKangaroo,evg6gi,[removed],history,Was it Attila who sent assassins after his death
54,PandazzlePro,evg3tp,[removed],history,What was the first war when flintlock pistols were issued
55,deags13,evg1ys,[removed],history,Police to participate in new Auckland parade after last years PriText you copy will automatically show herede Parade ban
56,JonSolo1,evfy0s,[removed],history,What were the Nazis plans for space
57,JNREEEE18,evfx7z,[removed],history,Are there any good sources or books regarding the fur trade pioneers and the French and Indian War
58,LiterallyARedArrow,evfpzo,[removed],history,Often in WW2 naval reports one nation will report a specific ship by name as destroyed damaged or spotted Why was it important to mention the name/destination of the ship in question and how did they identify them
59,dawn224,evfi1r,[removed],history,Any books about bizzare/strange/crazy facts or stories in history
60,Bilbow_Swaggings,evfb8v,[removed],history,Which are the best/most incredible/unbelievable true navy stories in history
61,pinoyathletics,evev46,[removed],history,This Is Lola a 5700YearOld Woman Whose Entire Life Is Revealed in Her Chewing Gum  Archaeology
62,holfweerwolf,evenqv,[removed],history,Mosquito  New WW1 movie
63,GnastyThot,evelfu,[removed],history,I know its a stretch but can anyone help me with identifying the man on this Victorian cameo brooch
66,Stevie1978,evdoqz,[removed],history,Margaret Beaufort  villain or heroine
68,Anglicanpolitics123,evd3gz,[removed],history,How aware was the global community of the Holdomor genocide in the Soviet Union
69,ubay700,evd1d3,[removed],history,Europe
70,PandazzlePro,evcx9d,[removed],history,Any books websites or sources youd recommend for a book on civil war rifles swords revolvers and artillery
71,AnakinWayneII,evci31,[removed],history,How many indigenous Carib peoples still exist today
72,reab923,evca1r,"Do people consider Lady Jane Grey a Queen of England? She was only queen for 9 days, but many people often forget about her/don't talk about her and she is usually not included in history.

Just wondering if she is spoken about in history classes or even if people in England learn about her as I only know about her because I do my own research about this era on my own.",history,Lady Jane Grey
74,lord_cumswell,evbzzu,[removed],history,What is a nazi
75,Nigromante_777,evbmj3,[removed],history,Are two handed scimitars historically accurate
76,zendayaismeechee,evb63d,[removed],history,Looking for some books on the French Revolution
77,Bigsmoke27,evazdt,[removed],history,Why would the allies consider bombing Auschwitz
78,[deleted],eva5ce,[deleted],history,Obviously A Major Malfunction  This is the indepth piece from the Miami Herald about the Space Shuttle Challenger disaster Extremely gripping and often graphic narrative of what really happened before during and after
80,MaxDonness3,eva1p3,[removed],history,what was pancho villas views on politics and government
82,htchop,ev9rrg,[removed],history,World War II and vintage radio on YouTube
83,big-boi-m60,ev9bmr,[removed],history,Was there any possibility of escaping the Colosseum as a gladiator
84,big-boi-m60,ev9acb,[removed],history,Was there any possibility of escaping a gladiator battle in Romeand was there anybody who did
85,IKeexI,ev93qz,[removed],history,USA during WWI
86,Gnomeopolis,ev926i,[removed],history,Are there historical examples of cultural hero worshipping of a long lost cause Example the prevalence of people who still appear to believe in the Confederate cause in the southern United States
87,scooterpooter819,ev91km,[removed],history,What happened above Hagia Sophia on May 28 1453
90,zeppelincheetah,ev8ndh,[removed],history,The Empire of Britain and the World Wars in a nutshell
91,Martin7431,ev8auh,[removed],history,Waterloo is often regarded as the turning point of the Napoleonic Wars If the Duke of Wellington couldnt have held off Napoleon until Prussian reinforcements arrived would the Coalition have lost the war
93,russe329,ev82uo,[removed],history,Which historical figures bust do/would you have on your desk Why
96,TheGOATofgoats999,ev7m2w,[removed],history,Have there ever been documented instances of female soldiers committing war rape against men
97,Poscetti,ev71sh,[removed],history,Wild West gunslingers in World War One
98,Giuseppe_Simonetti,ev6q6k,[removed],history,What do you guys think the most effective rifle was in world war 2 Also what do you think the better infantry rifle was in Korea/WW2 the M1 garand or M1 carbine
101,InD_ImaginE,ev6e70,[removed],history,How did civilizations in history build stone building before cement
102,BenkeiDNA,ev6alk,[removed],history,Where did ancient Greeks talk about higher air spaces/rooms
104,zakaran,ev666t,[removed],history,Reasons for the strength of Danelaw between 840 and 940
105,MyOrwellianNightmare,ev5zxz,[removed],history,Akin to Richard III Hitler was just crusading Discuss
106,WellingtonBlucher,ev5zlr,[removed],history,Why is Battle of Austerlitz always considered as Napoleon greatest victory and not some other battle like Wagram much larger battle Jena Friedland Ulm Marengo etc
108,0utremer,ev5h4w,[removed],history,What do you think about concept that USSR is as guilt as Nazi Germany in starting WWII
109,Rup_the_bitch,ev4vdq,[removed],history,Question about Ottoman tax revenue in 1914 and preferably also in 1918
110,BenkeiDNA,ev4d5z,[removed],history,Greek warrior Achilles fighting 15 soliders
111,MiscalculatedStep,ev4d0q,[removed],history,Why are people claiming ancient Egypt as their own history while modern Egyptians are forgotten about even though there is genetic evidence of a close genetic makeup
112,Swordofmytriumph,ev400n,[removed],history,Are there any good books about the history of the CDC
113,Josiboy_04,ev3zeg,[removed],history,The letters of Paul
114,Josiboy_04,ev3vez,[removed],history,The Romen Letters Paul
115,athrowawayforwork,ev3uni,[removed],history,Diving deep on into the Holodomor and USSR grain exports to the US
118,immortalAP,ev379m,[removed],history,What were the disadvantages to Britain of German expansion in Europe leading up to the second world war
119,juliapepsi,ev34y5,[removed],history,Do you think General Haig was to blame for the Battle of Somme Why or why not
120,gingapelle,ev341a,[removed],history,Why did normal people do the things they did in the holocaust
121,calsaw12,ev32pb,[removed],history,When did we start clipping our toe/finger nails
123,j4kub0k,ev2yt3,[removed],history,HI Im a presentation about ancient Greek architecture and I was wondering how they were building those temples especially how they were lifting the stones
125,mxh_13,ev26ip,[removed],history,Are the stories about buddha true
127,EffectiveCucumber6,ev1oxa,[removed],history,Which plan do you think is more realistic in 1919 the 14 points or the Treaty of Versailles
129,Seebooster,ev12mu,[removed],history,Are there any famous instances of defenders in a siege winning despite the walls being successfully breached
130,EEICData,ev11lr,[removed],history,Have power transitions ever been managed without bad relationships
131,Adonnus,ev0n6n,[removed],history,Are there any real audio recordings from the battlefields of WW1
132,knowledgeseeker999,ev0hwe,[removed],history,Rape after conquest
134,Codak_00,ev0460,[removed],history,WW1
135,not_homestuck,euzw97,[removed],history,Korean War Where is the modernday location of the Nevada Cities bases
136,Nucleoentropy52,euzvm0,[removed],history,Would it be wrong to say that at the Battle of Ltzen both sides possessed the best military forces in the world at the time
137,sohlop,euzoe6,[removed],history,In the historical record say between 16001750 or beyond that was the North Eastern part of the United States considered similar to the geography of Europe What about the West coast
139,Tuchaya,euzcg2,[removed],history,I survived the Bosnian Genocide at Srebrenica when I was 7 Trying to talk about it just to cope a bit cause Ive bottled it up for far too long Ive posted to other subs today and figured you guys might be interested or want to ask questions
140,External-Tennis,euzame,[removed],history,Hitler or Stalin
141,Worried111,euz88d,[removed],history,Why was empress Elizabeth of Austria a duchess before her marriageand not a princess
142,Danielex52,euz1b9,[removed],history,What were some military strategy games played by generals and officers
143,TacticalLlama69,euycew,[removed],history,Did the Canadians lose the Russian cival war
144,amirtheperson,euyccx,[removed],history,Books about the legends or quest for the City of Gold in the New World
145,reaperbunny,euxx76,[removed],history,I need homework help
146,duckdae,eux4dh,[removed],history,How many years must pass before it is acceptable for journalists to opine on the moral behavior of an historical incident
147,VincentDanger,euwzkq,[removed],history,I want to be a historian as a career choice
149,Hidden_Unknown,euw41f,[removed],history,Vikings on magic mushrooms
150,thatspuditguy,euw190,[removed],history,Ethelred the unready caused the st Brice day massacre after hearing that What is your opinion on him now
151,thatspuditguy,euvrjp,[removed],history,What is your opinion on Ethelred the unready
152,Level1Hermit,euvn2j,[removed],history,Why is American apparel informal compared to other developed countries
153,thatspuditguy,euvm7t,[removed],history,Opinion on Ethelred the unready 
155,lifeisbrighter,euvc3u,[removed],history,Question on Constantinople
157,Floorarm,euv3sn,[removed],history,What are some interesting events during the 19001910 decade
158,Seafox123__,euuwj6,[removed],history,New Historical Political Discord Sim
159,Charles_Titou,euuv2f,[removed],history,NOOOO
160,Communist_ukr,euunkl,[removed],history,Russian Empire
161,snfsylva,euujoj,[removed],history,Hungary and the Holocaust
162,dontwantppltoknowme,euuifx,[removed],history,Life in before WW1
163,PandazzlePro,euugtx,[removed],history,Is there a reliable website I can use to find out information about firearms from the US Civil War
165,Kairi_Yajuu,eutze0,[removed],history,Can you help me find an Article titled Prussia Poisons Us from 2002
166,Kairi_Yajuu,euts4d,[removed],history,Can you help me fine an article titled Prussia Poisons Us from February of 2002
167,DummyTHICKDungeon,eutkkx,[removed],history,What was a dickmaker
168,SecretsPBS,eutewf,"In April 1944, Jewish prisoners Rudolf Vrba and Alfred Wetzler miraculously escaped from Auschwitz concentration camp and fled through Nazi-occupied Poland to find refuge in Žilina, Slovakia, where they connected with the Jewish Underground. Once safe, they recounted what they left behind. Their harrowing testimony revealed the true horror of the Holocaust to the outside world, describing in forensic detail the gas chambers and the full extent of the Nazi extermination program.

While millions of troops fought on both fronts and battled for supremacy in the air during World War II, Nazi forces continued to deport Jews to the concentration camp.  As Vrba and Wetzler’s account made its way to Allies, the idea of bombing the camp was discussed at the highest levels of government. Prime Minister Winston Churchill, Allied Air Commanders, the American War Refugee Board and the Jewish Agency were presented with one of the greatest moral questions of the 20th century: Should we bomb Auschwitz and risk killing Jewish prisoners in the camp to stop future atrocities?

[Secrets of the Dead: Bombing Auschwitz](https://www.pbs.org/wnet/secrets/bombing-auschwitz-about-the-film/4685/) explores this dilemma through dramatic recreations of arguments that took place on both sides of the Atlantic and first-hand testimony from historians, survivors and expert voices. January 27, 2020, marks the 75th anniversary of the liberation of Auschwitz and International Holocaust Remembrance Day.


Watch the full episode here: https://www.pbs.org/wnet/secrets/bombing-auschwitz-ksouts/4804/


Answering your questions from u/SecretsPBS today is:


Historian and co-editor of The Bombing of Auschwitz, Michael Berenbaum.

Michael Berenbaum is a writer, lecturer, and teacher consulting in the conceptual development of museums and the development of historical films. He is director of the Sigi Ziering Institute: Exploring the Ethical and Religious Implications of the Holocaust at the American Jewish University (formerly the University of Judaism) where he is also a Professor of Jewish Studies. In the past he has served as the Weinstein Gold Distinguished Visiting Professor at Chapman University, the Podlich Distinguished Visitor at Claremont-McKenna College, the Ida E. King Distinguished Professor of Holocaust Studies at Richard Stockton College for 1999–2000 and the Strassler Family Distinguished Visiting Professor of Holocaust Studies at Clark University in 2000.

Website: https://www.michaelberenbaum.com/about

Proof: https://i.redd.it/31atexd9u7d41.jpg",history,Im Michael Berenbaum a Historian who Specializes in the Effects of the Holocaust I Appeared in a Documentary Focusing on one of the Greatest Moral Questions of the 20th Century Should the Allies Have Bombed Auschwitz Ask Me Anything
169,SatanTookMyIkeaShark,eut7yt,[removed],history,what do you think is the most important part of american history
170,HeezerTop,eusz23,[removed],history,Why is the Indonesian mass killings of 196566 not so well known in the west as the Khmer rouge killings 
172,Communist_ukr,eusuom,[removed],history,Project Yellow Russia
173,eclipsenight,eusr2y,[removed],history,Radioactive dating of objects during WWII or nuclear testing
174,Norbert19970,eusqqk,[removed],history,75 years
175,Strajker6996,eusafn,[removed],history,The Medici FamilydeMedici
176,Tcrumpen,eus8d7,[removed],history,Why hasnt Auschwitz been leveled/destroyed
177,broodjetoktok,eus6p1,[removed],history,Why were the puritans against the globe theatre
178,Communist_ukr,eurnri,[removed],history,I need some help
180,BamboozledBeluga,eurc62,[removed],history,Help choosing a book for a school project
182,ashberet,euqucq,[removed],history,Any good books on the First and Second French Empires
183,RemarkableAlps,euqpvq,[removed],history,Why are Fire Arrows so prevalent in Tv amp Film
185,Mithrillo_von_Kolt,euqiyw,[removed],history,Who are the biggest snitches in history
189,SuchSecond,euq037,[removed],history,How many people in Italy died of the Spanish flu
190,Agent_Michael_Scarn1,eupzt6,[removed],history,Why isnt emperor Hirohito remembered and spoken about the same way Stalin Hitler and Mussolini are
191,gandalfonreddit,eups5v,[removed],history,What myths about medieval Europe do people still believe but turned out to be completely wrong
192,J4nis05,eupgah,[removed],history,I dont really know if this is the right place but
194,SpoopS77,eupdtp,[removed],history,If you could fly any aircraft from history for just one flight what would it be and why
196,SpoopS77,eup7yd,[removed],history,If you could fly any plane from history for just one trip what would it be
200,IWI_Tavor_7,euouyv,[removed],history,something about cavalry
201,justausedtowel,euonux,[removed],history, For cases where the baby was completely obstructed some Roman doctors recommended inserting a knife into the mother and dismembering the foetus in the womb  SPQR Mary Beard p57 What was the name of this procedure and how common was it More questions inside
204,LatinCyclist,euo63d,[removed],history,Petronius last letter to Nero
206,Opfaff,euo1a8,[removed],history,Guards of Auschwitz
207,queendarinna,eunri2,[removed],history,Best Doucseries that show the Eastern Front during WW2 in a Non Basis or Truthful Way
208,Pietro-Cavalli,eunpxj,[removed],history,When did the power of the english monarchs decline to be so insignificant
211,Eaglewolf13,eumowt,[removed],history,Proof that Hitler had blue eyes
213,KT1812,eumaer,[removed],history,Can someone direct me to a place to learn about Czech history
214,bcowling,euma1f,[removed],history,Stamp Books from circa 1940s
217,Stevie1978,eulkx5,[removed],history,English monarchy
218,EbenGraphics,eulfob,[removed],history,What should I visit in Greece
219,hierpower,eulfhk,[removed],history,FLAVIAN DYNASTY TITUS GREATEST MAN OF THE COMMON ERA
