,author,id,selftext,subreddit,title
598,foiceemartelo,eskcas,[removed],history,Ancient Greece Book recommendation for the period between the Peloponnesian war and the death of Alexander the Great
599,P1nkSt1nk,eskc0t,[removed],history,Cold War in comparison with German Colonialism Wilhelm II and Bismarck
600,Hoodlock,esju4d,[removed],history,Does the term things went south refer to the American Civil War
601,madvidak,esjrhg,[removed],history,What are some good books on American History
603,Fragequestion,esj83x,[removed],history,Resist Against the Khmer Rouge
605,Babywipeslol,esimsv,[removed],history,Were other presidents that were impeached and Nixon still supported as much as Donald Trump seems to be or were the American people more unified
607,HowDoBirdsWork,eshu9v,[removed],history,Winning Generals who died during their victory 
609,ShowelingSnow,eshjqe,[removed],history,Cant remember the name of a book that explained why there wont be another global war only a couple of years before WW1
610,kra211,eshg1a,[removed],history,Western Fabulist
611,Belphegor_6,esh7uw,[removed],history,How did armies in the past communicate during a battle
612,xXfetusXx69,esgxf1,[removed],history,I want to learn more about the Wild West
614,uppre,esghdw,[removed],history,So about spies
615,caleminesahara,esga85,[removed],history,Writing a book based on teenagers in the late 60s
616,Dig_Douggadome,esga4k,[removed],history,Recommendation for books on modern africa
617,MySojuBottle,esfx54,[removed],history,Historical examples of pop culture or entertainment media influencing politics of a state that it didnt originate from
618,marcassh1,esftxz,[removed],history,Were American settlers aware of Spaniards in the west
619,Graceful_Swan_Ronson,esfkcg,[removed],history,How did romaine lettuce become ubiquitous in salads all across America
620,JamestheRunner,esfgkz,[removed],history,When did high ranking officers stop going onto the battlefield
621,SaGlamBear,esfbnw,[removed],history,When did the English language lose the pronouns thou thee thy thine thyself and are there any English speakers around the world that still use these pronouns on a daily basis
622,Gabern,esf8kv,[removed],history,What are some great or notable empires that were at a peak before inevitably falling
624,Grandmaster_Dante,esf7d1,[removed],history,European Intellectual History Paper Ideas
626,marcassh1,esf1sb,[removed],history,Were early American settlers aware of the Spaniards in the west
629,ChristianV1000,esetxu,[removed],history,Gilded age memes
632,CmdrHoopla,esepfl,[removed],history,Playlist Every Year in Classical Music 16002000
633,curiozitet,esenyh,[removed],history,Enigma regarding scyldings / yngldings and house of munso Ancient Scandinavia
634,SUBUTAl,esemeo,[removed],history,Why did the British despise American warfare especially in the war of 1812
635,Nac_Lac,eseg5p,[removed],history,When were the effects of drinking alcohol and tobacco smoke known to harm unborn children
636,kaydenkai10,ese8w9,[removed],history,Crusades books
637,neworleanssaintsfan,esdznz,[removed],history,John and Abigail Adams their love story as told through their letters
638,AgitatedKiwi07,esdypz,[removed],history,Why was Italian military expenditure prior to WWI so high
642,shallowblue,esc205,[removed],history,Who is the most obscure and unlikely person that history has remembered
643,t_curtin71,esbzgj,[removed],history,Homework help
647,desolateforestvoid,esbq11,[removed],history,Eye of Vichy french nazi propaganda English sub
648,Cpt-chevy,esbojl,[removed],history,Decorative WW1 German Jewish soldiers in the holocaust question
650,Knight451,esbgsq,[removed],history,Did Lothian welcome Scottish rule
651,Mallucaa,esbe5t,[removed],history,What were the reasons that a battle lasted for one or much more days in the past
653,MRJMAN19,esaqgt,[removed],history,I have a question about the Philippines
654,Author1999,esapdu,[removed],history,Why did east asia turn into a long period of isolation
657,Kazzoool,es9m26,[removed],history,EPQ Quiz
658,Hy-o-pye,es9h69,[removed],history,These YT Videos on Hitlers past blocked in many European countries
659,Puffdip1,es8zxb,[removed],history,crusade
661,Gloomy-Window,es8x6b,[removed],history,Sbjdjsjdjd
662,PBSexualPanda,es8g2e,[removed],history,What are some career paths for a history major
664,Ibeenjamin,es7xv6,[removed],history,What are the known cases of the US trying to sabotage and alter other countries elections throughout its history
666,HarryIrazu,es6xdz,[removed],history,Question on last words of Rangar Lothbrok
667,BernArch,es6spl,[removed],history,Samurai Helmets Kabuto
669,SpiderOfSummeria,es516a,[removed],history,Theory Karl Marx Had Autism
670,amitrajpant7,es4wqc,[removed],history,Why Nepal was Never colonized
671,Anglicanpolitics123,es4rdr,[removed],history,Is there any evidence that the Japanese were building Nuclear Weapons in WWII
672,Asone04,es4a4p,[removed],history,If the tensions were so high between the Soviet Union and Allied Powers Why didnt we kick them out of Europe
673,zpablo__,es3pe9,[removed],history,In movies medieval battles often take place in large open fields with one army against the other
674,Dew217,es3hzm,[removed],history,Why do people touch a big ball at conferences in China
675,KEVpo2016,es3czb,[removed],history,Great Leap Forward and The Cultural Revolution
676,AwkwrdPrtMskrt,es396o,[removed],history,When and why did Japan start using Western order for names
677,Corvidae-,es395t,[removed],history,Oppression prior to the 1800s
679,ThePoarter,es31zl,[removed],history,What was it like living as a wealthy but non noble man in the Late Bronze Age in Ancient Egypt
680,Alongstoryofanillman,es2ztv,[removed],history,Battle of Karnsebes
681,MedalinDOOM,es2xlh,[removed],history,What are your favourite WWII operations
682,Singularity2soon,es2o5g,[removed],history,What is historys earliest recorded example of a War of choice 
683,woogiooduduman,es22on,[removed],history,What is your favorite dictator to research and learn about
684,Doctordanger1999,es1u7h,[removed],history,Why did The Nazis waste so much time amd resources killing people
685,woogiooduduman,es18tq,[removed],history,Most interesting dictator
686,R0GERTHEALIEN,es14ev,[removed],history,What was the general reaction to General MacArthur receiving the Medal of Honor in WW2 despite the fact that he himself did nothing specifically brave or gallant
687,alwaysjordan,es0s73,[removed],history,Kursk or Stalingrad
688,That9gagDude,es0pp8,[removed],history,How did the Republican and Democrat Party in the US become associated with the colors red and blue
690,That9gagDude,es0kf2,[removed],history,How did the Republican and Democrat Party in the US become associated with the colors red and blue
691,Ralph-Hinkley,es0f2w,[removed],history,Why was Andrew Johnson impeached
693,Ralph-Hinkley,es08d9,[removed],history,Why was Andrew Johnson impeached
694,Ceoltoir74,erzyoc,[removed],history,Books or resources on the native peoples of Eastern Canada and the region around St Lawrence river
695,Apophis41,erzx6x,[removed],history,Where did the nickname the great originate from
696,oniryu246,erzwwi,[removed],history,Is there a database for Jens Dopkes scanned scroll work
697,Apophis41,erzsjd,[removed],history,Where did the nickname the great originate from
698,Object_Class_Euclid,erzom4,[removed],history,How much of their own territory did Ancient Empires really control
700,PovazskaBystrica,erz2cn,[removed],history,Guys what do you think would happen if Munich Agreement 1938 wasnt signed
701,MySojuBottle,erz1cy,[removed],history,What are some historical examples of entertainment media leading to political change in another nation
702,senor_Adolf,eryy0e,[removed],history,is Karl the 12th a better strategist than napoleon
703,HeedTheGreatFilter,eryub4,[removed],history,How did incumbent US presidents receive the news that they won reelection in the 19th century
704,EgirlProtectionUnit,eryah0,[removed],history,What if the Nazis used the Jews to fight on the battlefield
705,DevilShad0w,ery80y,[removed],history,I am a person who is interested in dead malls In Aberdeen WA there are two lost malls both which not a lot is known about I was wondering if anyone lives or lived in Aberdeen WA and could tell me about the South Shore Mall and the Wishkaw Mall I know what happened after 2007
706,MARTINELECA,ery4tl,[removed],history,Why werent the Allied armies better prepared to withstand the Chinese offensive in Korea
707,PersianPrinceBUS,ery41g,[removed],history,What Geniuses have died before the age of 50 in the time period before the 1950s
709,the_real_MVP_100,erxsv2,[removed],history,There are thousands of untold stories in World War Two Lepa Radics is one of them
712,Mukboy5,erx3uv,[removed],history,Medieval coats of arms In pitch battles how did they tell each other apart
713,PovazskaBystrica,erx0rh,[removed],history,Does anybody know something about breakup of czechoslovakian republic slovakian state and/or protectorate of bohemia and moravia
714,Sierpy,erwyrz,[removed],history,How did the matricular contributions of the German Empire work
719,Loosymoosy,erw8lp,[removed],history,How much do we know about the native NorthAmerican people before the discovery of the continent by Europeans
720,thephishman101,ervp6l,[removed],history,What are some of the most turbulent and chaotic events in modern human history from the perspective of ordinary people/commoners
721,ihaveallthelions,ervku4,[removed],history,What were some of the more prominent African Kingdoms/Empires and do any of them still technically exist
722,kdm_usa,ervayj,[removed],history,How did people prove their identities in the 19th century
723,BillyBabel,erv8pk,[removed],history,In modern day weve created time capsules for people hundreds or thousands of years into the future to find is there anything similar in history to this Where something was made or written with people far in the future as an audience in mind
725,EHSYATA,erv255,[removed],history,When did the Japanese tradition or practice of Chikan rise to prominence in Japanese society
726,EnglanderMike,eruw91,[removed],history,Before start of WW1 in 1914 did Germany their generals know how weak their only real ally AustriaHungary was and them being only paper tiger
727,_Master_Baiter_,eruw5d,[removed],history,When did the Japanese tradition of Chikan originate is this a recent development What were the driving forces behind its cultural emergence
728,LumoSonic,erukei,[removed],history,What are examples of ignorance in history
729,TyrannosaurusRekt238,ertha6,[removed],history,What is the consensus of this subreddit on Robin Lane Foxs Alexander The Great
731,klearlykosher,ersvo4,[removed],history,How original is the Amish mentality
733,allah_is_gay_1,ersryt,[removed],history,why were jews expelled in every country they inhabited  i know they werent kicked out of india but why were kicked out of countries in europe and middle east
734,tomtubeyt,erspnq,[removed],history,What is the exact date Northern Ireland joined the United Kingdom
735,Markusthomsrud,ersmwt,[removed],history,Call me 47 451 85 545
737,greenlion98,errtv6,[removed],history,Where could I find a list of the Roman Senators of 49 BC
739,bruhwheresmyjuul,errgb8,[removed],history,ok I need to know
741,mksharmaji,err1yl,[removed],history,Vashikaran Specialist 918729032992
742,raveenas284,err19h,[removed],history,ICSE Class9 History Civics Guide Get from Extramarks
743,Junker52,erqsd9,[removed],history,Why didnt the Russians pursue a prolonged war against the Japanese during the RussoJapanese War
744,Real_Carl_Ramirez,erqmd2,[removed],history,How come some cases of national crisis lead to racist attacks while others dont
745,loot168,erqdsb,[removed],history,Admirals who became emperor
748,kdeshwal,erpti8,[removed],history,Communication during world war two pacific
749,aaHBN,erp5ng,[removed],history,Aside from the War Powers Act have any other resolution in our history seroiusly challenged the power of the president to wage war
750,Rando1ph,erp1m9,[removed],history,Germany
751,ashberet,erouv3,[removed],history,Could Rome have preserved itself as a nation in Italy
752,Godly_Quanta,erojdm,[removed],history,What were some major problems the Roman Empire faced when trying to conquer ancient Britain Also why conquer Britain
753,ChrisSurvivor,ero67s,[removed],history,Dont forget that the FBI organized the asassination of MLK Jr after over 100 failed attempts at driving him to suicide
754,felpipo,ero4n3,[removed],history,Need some help finding a reference
756,georgiaraisef,ernr8r,[removed],history,In most movies and tv shoes signing up to become a crew member of a ship was a quick and straightforward process Just signing your name in a book What was the process really like for bringing on crew members
759,BiIINyeTheRussianSpy,erned7,[removed],history,Help with this I was researching for my project but I am confused here can someone clear this out
760,toontownUSA,erndxy,[removed],history,An American history project
762,Walknasty,ermitj,[removed],history,Book recommendations about Yugoslavia amp Balkanization
763,Jamesleo119,ermih8,[removed],history,what was it about the nineties that led to the rise of grunge
765,blue_eulogy,erlgr4,[removed],history,What side effects do wars typically have on economy
767,cajcaj8,erl5w7,[removed],history,Question about the battle of Marathon 490 BCE
769,SgtAutismo,erl1ry,[removed],history,How did a day looked like in London 1940 Was it like a normal day with possible bombings or more apocaliptyc More questions below
770,creeper321448,erkveq,[removed],history,What was boot camp like in the army from the 17001800s
771,creeper321448,erku2s,[removed],history,What was boot camp like for the army in the 1700s and 1800s
772,Party-Discipline,erkfp4,[removed],history,Byzantine Empire
773,Pierre--Bezukhov,erkdl5,[removed],history,Rollbacks on Obama policies
774,Bleus4,erk88r,[removed],history,Did Martin Luther King Jr ever meet a former slave
775,Pierre--Bezukhov,erk6i0,[removed],history,A thought on the Trump Adminstrations roll back of Obama Era policies
777,Bleus4,erk2ul,[removed],history,Did Martin Luther King Jr ever meet a former slave
779,PandazzlePro,erj78e,[removed],history,If the founding fathers Franklin Washington Adams Jefferson Madison Hamilton and Monroe were alive during the civil war whos side would they take
780,DrTerpenstein,erj1a7,[removed],history,Did being a member of the WaffenSS automatically make one a war criminal
781,kk51wildcat,erih6d,[removed],history,Technically not about history but
782,firestar1121,erif3h,[removed],history,In the German army who had hats and who had helmets
783,OnceBraveAlwaysBrave,eri2zo,[removed],history,Anyone who could do researchs on Chechen history
784,TorchwoodCaptainJack,eri1vq,[removed],history,Ive been interested in the dark ages for awhile but i have no idea where to look or go to find factual history on them Anyone know where i could go online or anything
785,Anglicanpolitics123,erhy4k,[removed],history,Is it possible to be objective when telling history or will there always be a bias
786,TangledEarbuds61,erhy2e,[removed],history,Are there any notable examples in history of a great strategist but bad tactician
788,ImBoredHello,erhnxn,[removed],history,The Vox YouTube series Missing Chapter is an extremely interesting collection of untold stories
789,RangoMcGruffy,erhl4x,[removed],history,Which United States leaders were falsely labeled as terrorists by the US Government
790,C-Rich115,erhg4u,[removed],history,Were there any empires notoriously famous for having the sick and wounded fight
791,murder_train88,erhbnn,[removed],history,How long after the war for independence did it take early Americans to lose their British accents
792,Dark_syed,erh4fe,[removed],history,What was Boston tea party I tried google but it was a long answer
793,PandazzlePro,ergvgk,[removed],history,If the founding fathers being Washington Adams Jefferson Madison Hamilton Monroe and Franklin were alive during the civil war what side do you think theyd join Union or Confederacy
795,Crusading_Canadian,erfu44,[removed],history,Since Feudal titles derive from Roman titles what would be titles of rulers if we had a societal collapse and they based their titles off ours
796,sagan10955,erfssw,[removed],history,What role did Native Americans play in the Revolutionary War
797,MarcusRashford101,erfi4a,[removed],history,Comparable to Japanese internment and treatment of Allied personal and civilians why is the interment of JapaneseAmericans such a national shame in America
798,Anos-Seloth,erfb84,[removed],history,The other brother Welch the 1877/78 FA Cup and subjectivity of memory
799,Yopiee3,erf6m7,[removed],history,Please I need help
800,YankeesTrader1991,erf51a,[removed],history,My family immigrated from modern day Turkey to the Amalfi Coast in the mid 1500s what can I take from this historically
801,cking145,erevaq,[removed],history,Book recommendation  looking for something similar to Ernst Jungers A Storm of Steel
802,Godly_Quanta,ere573,[removed],history,Questions regarding drawbacks of Roman Consulship during the republic era
805,yungdumplin,ere0gz,[removed],history,Has anyone here studied religious history and if so can you point me towards a timeline of the Christian religions emerging
806,uk49s-lottery,erdzfc,[removed],history,UK 49s Lunchtime Results Monday 20 January 2020
809,Alwin_,erdnl9,[removed],history,Why after the attack on Pearl Harbor did the Japanese not invade it
814,Parakeet2018,ercsi1,[removed],history,Suggestions Lack of black British and European history
815,Adonnus,erchzy,[removed],history,What was the class breakdown of the UK in 1870 or any nearby time
816,fifaquestionss,ercbpf,[removed],history,Suggestions for history to learn/podcasts
817,URHeard,ercavb,[removed],history,Eurocentric History need help with Eastern Europe
820,TJ_1302,erbxuv,[removed],history,German patriotism
821,Wangotango214,erbxus,[removed],history,Did the Ottoman Empires decline allow women to take a larger role in the literary world during the Tanzimat Reforms and onwards
826,Linusag,erboeh,[removed],history,Soviet Union
827,Ikacprzak,erbkk4,[removed],history,Did James Earl Ray Act Alone
828,SteelRazorBlade,erbjcq,[removed],history,What is the difference between premodern imperialism/expansion and earlymodern colonialism
829,dangit1590,erbcue,[removed],history,How were the Japanese treated in ww2 by the Nazis in occupied territories and or discussed
831,jay_bleu,erax4w,[removed],history,How different would the world history be if we never invented gunpowder
832,oh_the_hoomanity,eram0k,[removed],history,Would anyone be interested in a AITA subreddit but for history
839,mattwinkler007,er9gbf,[removed],history,How absolute was the Japanese peoples conviction in continuing to fight in WWII
840,facechat,er99m4,[removed],history,Why were intellectuals untrusted to the extent of being killed in China Cambodia and other revolutions
841,DomusLinnaeus,er8ves,[removed],history,Why didnt Germany go for Russia first in WW1
842,Majoraisyourgod,er82tv,[removed],history,Where can I find a PDF version of The Nuremberg Chronicles
843,jcclar12,er7rvy,[removed],history,Is this Netflix show accurate Yanxi Palace Princess Adventures
845,JustTheBest123,er6fi4,[removed],history,What Perspective of World History are you given through your home country
846,picnictool,er6d3b,[removed],history,Byzantine Empire missing from you education too
847,Ryan_22,er6b7m,[removed],history,Is The Story Of Civilization still accurate
848,power-of-the-mind,er69lr,[removed],history,What happened to Spain after their economic collapse
849,B4bradley,er68ff,[removed],history,I love learning about WW2 and try to watch every documentary I can about it but I cant recall ever hearing anything about Portugal What was their role during the war
850,Petrobyas,er5g3w,[removed],history,Much of the accepted narrative about Rosa Parks life and arrest is wrong Yes even that Drunk History episode
851,atavastic_wren,er516t,[removed],history,Rothschilds history
853,foreverpregg,er4yqg,[removed],history,Please someone for the love of god tell me What happened to FRANCE after the Hundred Years War
854,shallowblue,er4xjp,[removed],history,How did tiny Greece defeat mighty Persia
856,LuchDaLej,er3io4,[removed],history,Why did the methods tactics and equipment of Ancient Rome change as Italy and the later Roman Empire change as they moved into the medieval period
859,R120Tunisia,er3789,[removed],history,What if the Edict of Nantes wasnt revoked and France continued to be around 15 Calvinist 
860,Fulcherofchartres,er2zft,[removed],history,BS vs BA
861,Anglicanpolitics123,er2yk4,[removed],history,Did the Holocaust galvanize support for the Zionist movement after WWII
862,biffpipp,er2ern,[removed],history,Why Did The Serfs Work For One Year And One Day
863,felipoca14,er25nt,[removed],history,An USSR hat
865,biffpipp,er24kn,[removed],history,Why Did The Serfs Have To Work One Year And One Day
867,XyZ_MaN,er1ohs,[removed],history,Does anyone have a link to that peice of soviet anti german propaganda that shows swatikas turning into graves
868,DontForget_ToLove,er0tw7,[removed],history,HELP Cant remember a word commonly used in history that I need
870,Crackdown66,eqzmy6,[removed],history,What European country has had the most violent history
871,BigDealRahil,eqzhis,[removed],history,What were realistic different outcomes for the independence of India
872,Crackdown66,eqzhhe,[removed],history,What two countries or peoples in the area of Europe have had the bloodiest most violent history
874,BeGood981,eqzbz4,[removed],history,History of Pork restriction in middleeast
875,cybersoldier93,eqyvmc,[removed],history,Which burning/destruction of the Library of Alexandria did the most damage
878,Red-Right,eqykrg,[removed],history,Secret Vote to AllRussian Congress of Councils
879,ltzmy,eqyd6e,[removed],history,To what extent did the Cultural Revolution destroy Chinese culture
880,MohitSuhag028,eqy4mx,[removed],history,Did guilt eat up the people who actually did the bad things by the order of their seniors or in the name of something biggerjust to justify their deeds OR they lived happily ever after
881,Oberst_Baum,eqy3qo,[removed],history,The origin of surnames in different countries
882,DanielSmith8446,eqxpow,[removed],history,Who do you think would be the most dominant empire if they were to be resurrected to the world we have today
883,iMiscellaneous2,eqxbxa,[removed],history,Do we know of any important historic events before written history
884,wolf751,eqx5hu,[removed],history,Napoleonic times refugees
885,max33rbr,eqx34u,[removed],history,Does somebody know Elfriede Hartmann or the Dblinger Mdchenmittelschule
887,cadensaysthings,eqwfk1,[removed],history,How the US got its first presidential helicopter
889,ReddituserXIII,eqvae7,[removed],history,Cooking and ingredients of the 1300s
893,caycadszz,equ15e,[removed],history,THE TWO POPES Netflix movie What really happened
894,caycadszz,eqtxd7,[removed],history,The 2 Pope
895,silicon_prophet,eqt2fv,[removed],history,In what calendar are BC years written in
896,Chicken_Spanker,eqrw4l,[removed],history,If a 19th Century gentleman or lady wanted to shock others and colour their conversation up with some swear words what are some terms no longer in use today they might employ
897,tb200,eqrlvq,[removed],history,Where do I find official records for WW2 British naval vessels
899,bighatcat,eqqvvl,[removed],history,Visual Study Guides to the Middle Ages 
900,Anglicanpolitics123,eqqttk,[removed],history,Is it true that George Washington wasnt that good of a general
901,tharkimadrasi69,eqqog4,[removed],history,Are Bill OReillys historical stories any good
902,Chicken_Spanker,eqq919,[removed],history,If a 19th Century gentleman or lady wanted to shock others and colour their conversation up with some swear words what are some terms no longer in use today they might employ And which ones would be be surprised to find familiar from todays use
903,apocalypse_later_,eqpr8z,[removed],history,Why did the Persian empires never consider expanding and conquering the Far East
905,dombra,eqpknq,[removed],history,I am a filmmaker and could use your help on the Maya
906,She_is_No_One,eqpcmt,[removed],history,Advice Careers that Combine Environment and History
908,DrunkenLupus,eqp7mr,[removed],history,Looking for a firstperson account of a Medieval battle
909,bojun,eqoxld,[removed],history,After the Notre Dame fire scientists get a glimpse of the cathedrals origins
910,dustybun_2105,eqot2r,[removed],history,Any good books on exploration of the new world
912,Mach1217,eqo593,[removed],history,What are some of your favorite last stand stories throughout history Can be either successful or failed
915,dombra,eqnm81,[removed],history,I want to learn more about the Mayans What is one fact that not many people know about them
916,neogrit,eqngs7,[removed],history,Jurchen hairstyle why
918,ObberGobb,eqmfoc,[removed],history,Can someone explain how Trench Warfare worked in WW1
919,mena_akram1,eqlgj4,[removed],history,Pyramids
920,Accelerator231,eqlbm7,[removed],history,How did human life change before and after expansive electrical lighting
921,PhyliA_Dobe,eql70w,[removed],history,Leonardo Davinci Lifestyle Question
922,AustinioForza,eql262,[removed],history,I have some questions about the internal governance of Athenian and Roman imperial cities and territories
923,SomeGuyFromMissouri,eql0ip,[removed],history,How did they keep track of years in BC and when and how did they change the years to BC and AD
924,Miclone92,eqkn7t,[removed],history,Making up for a less than great schooling
925,Vacrins,eqk264,[removed],history,What are some good books regarding the fall of the Western Roman Empire
926,Mir0zz,eqjqt8,[removed],history,Were the German civilians allowed to visit the occupied countries during ww2
