,author,id,selftext,subreddit,title
1,chiddicks,ew70pw,[removed],history,Organising Your Family History
4,atumhal,ew656m,[removed],history,Helen
5,ValleDaFighta,ew61jk,[removed],history,Early American colonists sometimes referred to Native American leaders as Kings or Emperors later and to this day we generally call them Chiefs When did this change happen
6,dovetc,ew5mgt,[removed],history,Did subsaharan African civilizations have domesticated horses
7,Anglicanpolitics123,ew5d8p,[removed],history,After Cannae did Hannibal have the resources necessary to lay siege on Rome
8,EththeEth,ew4yo9,[removed],history,Hungarian peoples Army Tanks 1960s
9,Anglicanpolitics123,ew4fhk,[removed],history,Would the Transatlantic slave trade count as a genocide in history
10,dvorahtheexplorer,ew4f22,[removed],history,What lessons from history are applicable to the common people
11,plasmazzr60,ew3w9m,[removed],history,Operation Pluto and the bay of pigs
12,BiggyTiddy27,ew3w8b,[removed],history,What lies were told during the cold war
13,BiggyTiddy27,ew3srj,[removed],history,What lies were told during the cold war between the US and the USSR
14,third3y3,ew3pu9,[removed],history,The spread of Iron Age weaponry
16,joelantonio,ew39dx,[removed],history,Ask Christianity in the politics of the Roman Empire
18,BornetoAlien,ew2exg,[removed],history,I need ww1 vector map
19,BornetoAlien,ew2ech,[removed],history,Does someone have ww1 vector mapIf yes send it to me in svg file
20,patoreddit,ew21vu,[removed],history,What have we actually learned from fallen empires in how they should actually be run
21,MamasMilkFactory,ew20ml,[removed],history,Was there a secret meeting between Stalin and Hitler in Lvov in October 1939
22,raidsyed1234,ew1sk5,[removed],history,What were some late medieval landing boats
23,turntlatr,ew17kz,[removed],history,History major graduates of reddit need some career advice
24,grnraa,ew10ml,[removed],history,TIL about the tragic life of Wanrong last Empress of Qing China
25,succulentscientist,ew10el,[removed],history,Reign  The TV Series
26,Waffle8,ew0snv,[removed],history,What was the significance of the AlsaceLorraine region WW1
27,Waffle8,ew0rth,[removed],history,Why was the AlsaceLorraine religion desired by both France and Germany and why was it a natural battleground WW1
28,AgSsM02,ew0pd5,[removed],history,Books
29,the-apostle,ew010z,[removed],history,Things that went right for the Germans in World War 2
30,TheAirplaneGuru,evznzb,[removed],history,Can anyone point me to a book or documentary on Oda Nobunaga
33,draw818,evz4qf,[removed],history,Famous photographs or events in history
34,serious-panda,evyq1c,[removed],history,1963
35,pooptirt,evyj5c,[removed],history,Potential for the same homeroom
36,nooblet_1738,evyd3c,[removed],history,Good books about ancient Central America peoples
38,StealingHistory,evy09w,[removed],history,The True Story Of One Of Wildest Ghost Towns In The West
39,bluecarousel7,evxggt,[removed],history,wow
40,haldemand2021,evx3f1,[removed],history,Did Lincoln free the slaves
41,Evil_Empire1,evws8v,[removed],history,I want to major in history and then maybe probably teaching history after Should I go through with this is it worth it and is there anything I should think about or consider
42,PugsAndHugs95,evwms5,[removed],history,What are some notable cases of people throughout history representing themselves in court and actually prevailing
43,sztyftwsztyfcie,evwbht,[removed],history,How forts outside of the city could protect it
44,MindlessMacaroon,evvydr,[removed],history,Live shell lands on deck man throws it overboard marries captains daughter
45,Vigilant_Tyranos,evvj9q,[removed],history,How did the colonies fund their fight against Britain in the American Revolutionary war
46,BDream3r,evuzxc,[removed],history,Question about colonies abandonment cases during the colonial era
47,Earl_of_Cola,evuu5h,[removed],history,Cases in sports where both teams were paid off
48,Trumlik,evusn3,[removed],history,How did in the fourteenth century to eradicate the black plague
49,somepersononthewebz,evurqz,[removed],history,Where can I find some good reconstructed historical datasets
50,FriendlyLocomotive,evunrr,[removed],history,When and how did the French develop a love for cavalry
51,FriendlyLocomotive,evuleb,[removed],history,When and how did the French develop a love for cavalry
52,TigPlaze,evudag,[removed],history,Hitlers sexuality
53,scooterpooter819,evu65b,[removed],history,History on replay
54,yrn2326,evtmrq,[removed],history,What do you think the Philippines would be like today if america never took it from the spanish
55,Stevie1978,evthq7,[removed],history,Reading into the War Of Roses and Henry VII Margaret Beaufort is she a heroine or villain
56,Stevie1978,evtf9d,[removed],history,Margaret Beaufort  heroine or villain
57,Nucleoentropy52,evsqt1,[removed],history,Why did Albrecht von Wallenstein bother with an armoured bodyguard of 200 Lancers when he couldve just used cuirassiers instead
59,IcyWarp,evslwn,[removed],history,I want to become a student of history Where/how do I begin
60,norikpr,evsgt8,[removed],history,Why was the Ottoman Navy unable to stop Genoese reinforcements during the Fall of Constantinople
61,russe329,evs4m9,[removed],history,What bust would/do you have in your office
62,SaltCounter6,evs0ld,[removed],history,T
63,oscar27436,evrylg,[removed],history,Religion caused WW1 and most all other wars too
64,1owen1,evrlpd,[removed],history,holocaust Video
65,Bojack_Hollyhock,evrkpf,[removed],history,Despite having a big size many natural resources and productive lands a big coast and few external wars why Brazil in 19th and early 20th centuries was not able to have a growth of his economic military and political power similar to what USA and China had
68,HunterRiess,evr7ad,[removed],history,Warren G Harding was the best president ever
69,destructor_rph,evqvkv,[removed],history,Are there any examples of cultures in history that DID NOT form a religion
70,Mithras-xx,evqs16,[removed],history,Tamerlane and Timurid Empire Ethnic Groups/Names
71,gingapelle,evqn56,[removed],history,How would Europe look if nazi Germany won the war
75,elizabxthdarcy,evpd7m,[removed],history,French History
76,Juliusx2,evp5t9,[removed],history,What kind of buttons did people wear/make in the 19th century UK
77,PR280,evoquz,[removed],history,Just thought Ill tell the story of the 1st and hopefully last assasination of an Israeli prime minister issac Rabin
80,JayColby7,evnxs1,[removed],history,Mamie Johnson First Woman Pitcher In The Negro Leagues
81,thaHaremKing,evnqjt,[removed],history,In Early Western Democracies how much percentage of men were eligible to vote
83,pluto4749,evnipf,[removed],history,Someone can do a summery of the persians wars because I have a test and Im not in a good situation with them
84,hiteshhedwig,evmwvt,[removed],history,Concentration camps in World War 2
87,oxenham1,evlqt0,[removed],history,Why didnt Sitting Bull overrun Benteens defensive position after wiping out Custers group at the Little Big Horn
89,laszlo92,evll3a,[removed],history,Why did Liechtenstein not join German unification
90,Skifer91290,evlhnl,[removed],history,Why is it that Latin  the language  is so very romanticized in modern english culture
91,KspPaul,evl2ci,[removed],history,Are there any books letters or texts from allied soldiers on the western front in 1941 
92,ivanyongweikit,evkynt,[removed],history,Napoleon and the Hearts of Men
93,Mathias_Belmont,evkj5r,[removed],history,Does the History of Science have a Eurocentric focus
94,ReviewerRandom,evju6a,[removed],history,A weird question about revolutions
95,BeatriceBernardo,evjr9i,[removed],history,Before mass schooling what is it that adolescent do
97,BeatriceBernardo,evjhwl,[removed],history,Before mass schooling what is it that adolescent do
98,cataids69,evjhdz,[removed],history,What exactly was the connection between the USSR and the DDR
99,EthanTinsley17,evj33c,[removed],history,Was there ever a pill/drug that was used that people believed would cure homosexuality
100,ArthurMorgan_dies,evj1r7,[removed],history,I just realized that it is insane that WWI and WWII even happened It is like something from fiction but actually was real
102,SeinfeldGuy2001,evivke,[removed],history,I have a question is Fidel Castro a hero or bad guy
103,NakedCallWriter,evie7j,[removed],history,What the hell was Napoleons strategic plan following his return from exile
105,Taemojitsu,evh0sj,"The leader of the republic, Enomoto Takeaki, was 32 years old.

Second-in-command was French officer Jules Brunet, aged 31.

The imperial forces that defeated them were led by Kuroda Kiyotaka, aged 28.

""Kuroda is said to have been deeply impressed by Enomoto's dedication in combat and is remembered as the one who spared the latter's life from execution.""

""In the end, the victorious imperial faction abandoned its objective to expel foreigners from Japan and instead adopted a policy of continued modernization with an eye to eventual renegotiation of the unequal treaties with the Western powers.""",history,In 1869 remnants of the shguns military established a republic on the northernmost island in Japan
106,ToastyTree69420,evh0qf,[removed],history,US History question regarding the founding fathers and interpretation of the United States Constitution
109,IrishMemer,evgouo,[removed],history,Why did Germany and Italy take so long to unify but other European powers such as Britain France Spain The Netherlands amp Russia unified so quickly in comparison
110,Person5790,evgn4h,[removed],history,What were some of Napoleons impressive military strategies
112,IrishMemer,evglpu,[removed],history,Why did it take Germany and Italy so long to unify while other European powers like Britain France Spain Russia amp the Netherlands unified so quickly in comparison
113,overtimeoroverit,evgksi,[removed],history,How historically accurate is Rise of Empires Ottomans / Rise of Empires series on Netflix
114,CampingKangaroo,evg6gi,[removed],history,Was it Attila who sent assassins after his death
115,PandazzlePro,evg3tp,[removed],history,What was the first war when flintlock pistols were issued
116,deags13,evg1ys,[removed],history,Police to participate in new Auckland parade after last years PriText you copy will automatically show herede Parade ban
117,JonSolo1,evfy0s,[removed],history,What were the Nazis plans for space
118,JNREEEE18,evfx7z,[removed],history,Are there any good sources or books regarding the fur trade pioneers and the French and Indian War
119,LiterallyARedArrow,evfpzo,[removed],history,Often in WW2 naval reports one nation will report a specific ship by name as destroyed damaged or spotted Why was it important to mention the name/destination of the ship in question and how did they identify them
120,dawn224,evfi1r,[removed],history,Any books about bizzare/strange/crazy facts or stories in history
121,Bilbow_Swaggings,evfb8v,[removed],history,Which are the best/most incredible/unbelievable true navy stories in history
122,pinoyathletics,evev46,[removed],history,This Is Lola a 5700YearOld Woman Whose Entire Life Is Revealed in Her Chewing Gum  Archaeology
123,holfweerwolf,evenqv,[removed],history,Mosquito  New WW1 movie
124,GnastyThot,evelfu,[removed],history,I know its a stretch but can anyone help me with identifying the man on this Victorian cameo brooch
127,Stevie1978,evdoqz,[removed],history,Margaret Beaufort  villain or heroine
129,Anglicanpolitics123,evd3gz,[removed],history,How aware was the global community of the Holdomor genocide in the Soviet Union
130,ubay700,evd1d3,[removed],history,Europe
131,PandazzlePro,evcx9d,[removed],history,Any books websites or sources youd recommend for a book on civil war rifles swords revolvers and artillery
132,AnakinWayneII,evci31,[removed],history,How many indigenous Carib peoples still exist today
133,reab923,evca1r,"Do people consider Lady Jane Grey a Queen of England? She was only queen for 9 days, but many people often forget about her/don't talk about her and she is usually not included in history.

Just wondering if she is spoken about in history classes or even if people in England learn about her as I only know about her because I do my own research about this era on my own.",history,Lady Jane Grey
135,lord_cumswell,evbzzu,[removed],history,What is a nazi
136,Nigromante_777,evbmj3,[removed],history,Are two handed scimitars historically accurate
137,zendayaismeechee,evb63d,[removed],history,Looking for some books on the French Revolution
138,Bigsmoke27,evazdt,[removed],history,Why would the allies consider bombing Auschwitz
139,[deleted],eva5ce,[deleted],history,Obviously A Major Malfunction  This is the indepth piece from the Miami Herald about the Space Shuttle Challenger disaster Extremely gripping and often graphic narrative of what really happened before during and after
141,MaxDonness3,eva1p3,[removed],history,what was pancho villas views on politics and government
143,htchop,ev9rrg,[removed],history,World War II and vintage radio on YouTube
144,big-boi-m60,ev9bmr,[removed],history,Was there any possibility of escaping the Colosseum as a gladiator
145,big-boi-m60,ev9acb,[removed],history,Was there any possibility of escaping a gladiator battle in Romeand was there anybody who did
146,IKeexI,ev93qz,[removed],history,USA during WWI
147,Gnomeopolis,ev926i,[removed],history,Are there historical examples of cultural hero worshipping of a long lost cause Example the prevalence of people who still appear to believe in the Confederate cause in the southern United States
148,scooterpooter819,ev91km,[removed],history,What happened above Hagia Sophia on May 28 1453
151,zeppelincheetah,ev8ndh,[removed],history,The Empire of Britain and the World Wars in a nutshell
152,Martin7431,ev8auh,[removed],history,Waterloo is often regarded as the turning point of the Napoleonic Wars If the Duke of Wellington couldnt have held off Napoleon until Prussian reinforcements arrived would the Coalition have lost the war
154,russe329,ev82uo,[removed],history,Which historical figures bust do/would you have on your desk Why
157,TheGOATofgoats999,ev7m2w,[removed],history,Have there ever been documented instances of female soldiers committing war rape against men
158,Poscetti,ev71sh,[removed],history,Wild West gunslingers in World War One
159,Giuseppe_Simonetti,ev6q6k,[removed],history,What do you guys think the most effective rifle was in world war 2 Also what do you think the better infantry rifle was in Korea/WW2 the M1 garand or M1 carbine
162,InD_ImaginE,ev6e70,[removed],history,How did civilizations in history build stone building before cement
163,BenkeiDNA,ev6alk,[removed],history,Where did ancient Greeks talk about higher air spaces/rooms
165,zakaran,ev666t,[removed],history,Reasons for the strength of Danelaw between 840 and 940
166,MyOrwellianNightmare,ev5zxz,[removed],history,Akin to Richard III Hitler was just crusading Discuss
167,WellingtonBlucher,ev5zlr,[removed],history,Why is Battle of Austerlitz always considered as Napoleon greatest victory and not some other battle like Wagram much larger battle Jena Friedland Ulm Marengo etc
169,0utremer,ev5h4w,[removed],history,What do you think about concept that USSR is as guilt as Nazi Germany in starting WWII
170,Rup_the_bitch,ev4vdq,[removed],history,Question about Ottoman tax revenue in 1914 and preferably also in 1918
171,BenkeiDNA,ev4d5z,[removed],history,Greek warrior Achilles fighting 15 soliders
172,MiscalculatedStep,ev4d0q,[removed],history,Why are people claiming ancient Egypt as their own history while modern Egyptians are forgotten about even though there is genetic evidence of a close genetic makeup
173,Swordofmytriumph,ev400n,[removed],history,Are there any good books about the history of the CDC
174,Josiboy_04,ev3zeg,[removed],history,The letters of Paul
175,Josiboy_04,ev3vez,[removed],history,The Romen Letters Paul
176,athrowawayforwork,ev3uni,[removed],history,Diving deep on into the Holodomor and USSR grain exports to the US
179,immortalAP,ev379m,[removed],history,What were the disadvantages to Britain of German expansion in Europe leading up to the second world war
180,juliapepsi,ev34y5,[removed],history,Do you think General Haig was to blame for the Battle of Somme Why or why not
181,gingapelle,ev341a,[removed],history,Why did normal people do the things they did in the holocaust
182,calsaw12,ev32pb,[removed],history,When did we start clipping our toe/finger nails
184,j4kub0k,ev2yt3,[removed],history,HI Im a presentation about ancient Greek architecture and I was wondering how they were building those temples especially how they were lifting the stones
186,mxh_13,ev26ip,[removed],history,Are the stories about buddha true
188,EffectiveCucumber6,ev1oxa,[removed],history,Which plan do you think is more realistic in 1919 the 14 points or the Treaty of Versailles
190,Seebooster,ev12mu,[removed],history,Are there any famous instances of defenders in a siege winning despite the walls being successfully breached
191,EEICData,ev11lr,[removed],history,Have power transitions ever been managed without bad relationships
192,Adonnus,ev0n6n,[removed],history,Are there any real audio recordings from the battlefields of WW1
193,knowledgeseeker999,ev0hwe,[removed],history,Rape after conquest
195,Codak_00,ev0460,[removed],history,WW1
196,not_homestuck,euzw97,[removed],history,Korean War Where is the modernday location of the Nevada Cities bases
197,Nucleoentropy52,euzvm0,[removed],history,Would it be wrong to say that at the Battle of Ltzen both sides possessed the best military forces in the world at the time
198,sohlop,euzoe6,[removed],history,In the historical record say between 16001750 or beyond that was the North Eastern part of the United States considered similar to the geography of Europe What about the West coast
200,Tuchaya,euzcg2,[removed],history,I survived the Bosnian Genocide at Srebrenica when I was 7 Trying to talk about it just to cope a bit cause Ive bottled it up for far too long Ive posted to other subs today and figured you guys might be interested or want to ask questions
201,External-Tennis,euzame,[removed],history,Hitler or Stalin
202,Worried111,euz88d,[removed],history,Why was empress Elizabeth of Austria a duchess before her marriageand not a princess
203,Danielex52,euz1b9,[removed],history,What were some military strategy games played by generals and officers
204,TacticalLlama69,euycew,[removed],history,Did the Canadians lose the Russian cival war
205,amirtheperson,euyccx,[removed],history,Books about the legends or quest for the City of Gold in the New World
206,reaperbunny,euxx76,[removed],history,I need homework help
207,duckdae,eux4dh,[removed],history,How many years must pass before it is acceptable for journalists to opine on the moral behavior of an historical incident
208,VincentDanger,euwzkq,[removed],history,I want to be a historian as a career choice
210,Hidden_Unknown,euw41f,[removed],history,Vikings on magic mushrooms
211,thatspuditguy,euw190,[removed],history,Ethelred the unready caused the st Brice day massacre after hearing that What is your opinion on him now
212,thatspuditguy,euvrjp,[removed],history,What is your opinion on Ethelred the unready
213,Level1Hermit,euvn2j,[removed],history,Why is American apparel informal compared to other developed countries
214,thatspuditguy,euvm7t,[removed],history,Opinion on Ethelred the unready 
216,lifeisbrighter,euvc3u,[removed],history,Question on Constantinople
218,Floorarm,euv3sn,[removed],history,What are some interesting events during the 19001910 decade
219,Seafox123__,euuwj6,[removed],history,New Historical Political Discord Sim
220,Charles_Titou,euuv2f,[removed],history,NOOOO
221,Communist_ukr,euunkl,[removed],history,Russian Empire
222,snfsylva,euujoj,[removed],history,Hungary and the Holocaust
223,dontwantppltoknowme,euuifx,[removed],history,Life in before WW1
224,PandazzlePro,euugtx,[removed],history,Is there a reliable website I can use to find out information about firearms from the US Civil War
226,Kairi_Yajuu,eutze0,[removed],history,Can you help me find an Article titled Prussia Poisons Us from 2002
227,Kairi_Yajuu,euts4d,[removed],history,Can you help me fine an article titled Prussia Poisons Us from February of 2002
228,DummyTHICKDungeon,eutkkx,[removed],history,What was a dickmaker
229,SecretsPBS,eutewf,"In April 1944, Jewish prisoners Rudolf Vrba and Alfred Wetzler miraculously escaped from Auschwitz concentration camp and fled through Nazi-occupied Poland to find refuge in Žilina, Slovakia, where they connected with the Jewish Underground. Once safe, they recounted what they left behind. Their harrowing testimony revealed the true horror of the Holocaust to the outside world, describing in forensic detail the gas chambers and the full extent of the Nazi extermination program.

While millions of troops fought on both fronts and battled for supremacy in the air during World War II, Nazi forces continued to deport Jews to the concentration camp.  As Vrba and Wetzler’s account made its way to Allies, the idea of bombing the camp was discussed at the highest levels of government. Prime Minister Winston Churchill, Allied Air Commanders, the American War Refugee Board and the Jewish Agency were presented with one of the greatest moral questions of the 20th century: Should we bomb Auschwitz and risk killing Jewish prisoners in the camp to stop future atrocities?

[Secrets of the Dead: Bombing Auschwitz](https://www.pbs.org/wnet/secrets/bombing-auschwitz-about-the-film/4685/) explores this dilemma through dramatic recreations of arguments that took place on both sides of the Atlantic and first-hand testimony from historians, survivors and expert voices. January 27, 2020, marks the 75th anniversary of the liberation of Auschwitz and International Holocaust Remembrance Day.


Watch the full episode here: https://www.pbs.org/wnet/secrets/bombing-auschwitz-ksouts/4804/


Answering your questions from u/SecretsPBS today is:


Historian and co-editor of The Bombing of Auschwitz, Michael Berenbaum.

Michael Berenbaum is a writer, lecturer, and teacher consulting in the conceptual development of museums and the development of historical films. He is director of the Sigi Ziering Institute: Exploring the Ethical and Religious Implications of the Holocaust at the American Jewish University (formerly the University of Judaism) where he is also a Professor of Jewish Studies. In the past he has served as the Weinstein Gold Distinguished Visiting Professor at Chapman University, the Podlich Distinguished Visitor at Claremont-McKenna College, the Ida E. King Distinguished Professor of Holocaust Studies at Richard Stockton College for 1999–2000 and the Strassler Family Distinguished Visiting Professor of Holocaust Studies at Clark University in 2000.

Website: https://www.michaelberenbaum.com/about

Proof: https://i.redd.it/31atexd9u7d41.jpg",history,Im Michael Berenbaum a Historian who Specializes in the Effects of the Holocaust I Appeared in a Documentary Focusing on one of the Greatest Moral Questions of the 20th Century Should the Allies Have Bombed Auschwitz Ask Me Anything
230,SatanTookMyIkeaShark,eut7yt,[removed],history,what do you think is the most important part of american history
231,HeezerTop,eusz23,[removed],history,Why is the Indonesian mass killings of 196566 not so well known in the west as the Khmer rouge killings 
233,Communist_ukr,eusuom,[removed],history,Project Yellow Russia
234,eclipsenight,eusr2y,[removed],history,Radioactive dating of objects during WWII or nuclear testing
235,Norbert19970,eusqqk,[removed],history,75 years
236,Strajker6996,eusafn,[removed],history,The Medici FamilydeMedici
237,Tcrumpen,eus8d7,[removed],history,Why hasnt Auschwitz been leveled/destroyed
238,broodjetoktok,eus6p1,[removed],history,Why were the puritans against the globe theatre
239,Communist_ukr,eurnri,[removed],history,I need some help
241,BamboozledBeluga,eurc62,[removed],history,Help choosing a book for a school project
243,ashberet,euqucq,[removed],history,Any good books on the First and Second French Empires
244,RemarkableAlps,euqpvq,[removed],history,Why are Fire Arrows so prevalent in Tv amp Film
246,Mithrillo_von_Kolt,euqiyw,[removed],history,Who are the biggest snitches in history
250,SuchSecond,euq037,[removed],history,How many people in Italy died of the Spanish flu
251,Agent_Michael_Scarn1,eupzt6,[removed],history,Why isnt emperor Hirohito remembered and spoken about the same way Stalin Hitler and Mussolini are
252,gandalfonreddit,eups5v,[removed],history,What myths about medieval Europe do people still believe but turned out to be completely wrong
253,J4nis05,eupgah,[removed],history,I dont really know if this is the right place but
255,SpoopS77,eupdtp,[removed],history,If you could fly any aircraft from history for just one flight what would it be and why
257,SpoopS77,eup7yd,[removed],history,If you could fly any plane from history for just one trip what would it be
261,IWI_Tavor_7,euouyv,[removed],history,something about cavalry
262,justausedtowel,euonux,[removed],history, For cases where the baby was completely obstructed some Roman doctors recommended inserting a knife into the mother and dismembering the foetus in the womb  SPQR Mary Beard p57 What was the name of this procedure and how common was it More questions inside
265,LatinCyclist,euo63d,[removed],history,Petronius last letter to Nero
267,Opfaff,euo1a8,[removed],history,Guards of Auschwitz
268,queendarinna,eunri2,[removed],history,Best Doucseries that show the Eastern Front during WW2 in a Non Basis or Truthful Way
269,Pietro-Cavalli,eunpxj,[removed],history,When did the power of the english monarchs decline to be so insignificant
272,Eaglewolf13,eumowt,[removed],history,Proof that Hitler had blue eyes
274,KT1812,eumaer,[removed],history,Can someone direct me to a place to learn about Czech history
