,author,id,selftext,subreddit,title
220,Monehs,eul9n7,[removed],history,Im looking to understand a bit more about the mindset of individuals in medieval Britain I realise that its highly unlikely dues to low levels of literacy but can anyone recommend something resembling a medieval diarist
221,Monehs,eul6ut,[removed],history,Are there any readable British medieval diarists
222,qarton,euknbf,[removed],history,When was blowing bubbles first used as entertainment
224,qarton,eukj8n,[removed],history,When was blowing bubbles first used as amusement
225,UEyerTrigHt,euk4ex,[removed],history,75 years ago Audie Murphy earned his Medal of Honor with nothing but a burning tank destroyers 50 cal and insane bravery
226,hierpower,eujlcr,[removed],history,flavian christianity 
227,Shin-shoto,eujjsj,[removed],history,What events in history that you find hilariously stupid
229,tauheedahmad,eujb8b,[removed],history,The First Ever Airmail Must Get Through
231,PRINCE-KRAZIE,euj1jm,[removed],history,Have there ever been evil princesses either from stories or real life
232,tauheedahmad,euiycs,[removed],history,The World Takes Wing  The Adventure of Flight
233,Zephyr77_,euirua,[removed],history,Who has a better definition of the ending of history Marx or Fukuyama
234,rbuen4455,euip4n,[removed],history,Which is older Chinese or European civilization
235,rbuen4455,euimzw,[removed],history,Is Chinese or European civilization older
236,im_not_inevitable,eui3of,[removed],history,Nazi germany and the Soviet union were the same
237,HokutoHenry123,euhr48,[removed],history,Were people more learned in the past before the advent of the internet
239,Evinko,euhgrx,[removed],history,What century would be most like today
240,Tristan_Gabranth,euhe0b,[removed],history,Hi writer here If the fictional pope or high priest was assassinated during his crowning of a fictional king what would be the subsequent fallout
241,SoupyJews,euh49o,[removed],history,What do you guys think were the top 3 harshest battles of WW1 and why Im not just talking death toll but conditions weather etc
242,parkingfascists,eugtu7,[removed],history,Why doesnt Germany have a King amp Queen of Germany like in England
243,Hilz13,eugtbl,[removed],history,Could anyone recommend some good Western Civ research websites Taking my first online course and Im lost
244,luostneibma,eug7wm,[removed],history,The tuskegee experiment
248,Pinku_no_buta,eueohp,[removed],history,What would King Alfred think of modernday England
249,Lukethe206,euej1c,[removed],history,Thracian use of clubs
250,boondocks5,euefu5,[removed],history,The Peloponnesian Wars would be prime material for an HBO show How would do you think it would play out
251,Pinku_no_buta,eueawb,[removed],history,What would King Alfred think of modern day England
252,laxbruh12312,eue57z,[removed],history,What were the cause of the Mariel Boatlift
253,hugobustos95,eue3rf,[removed],history,Yes or No  Was Elizabeth I of England really a virgin
254,Catcher_Thelonious,eudzq9,[removed],history,Question regarding Wang Lun  White Lotus Rebellion 1774 Shandong
255,Wizekracker,eudvty,[removed],history,Can anyone recommend a book or podcast detailing the lives of early american settlers/ fronteirsmen
256,Fmagana26,eud8q6,[removed],history,Airships that looked like galleons with a giant ballon why werent they a thing
257,sleepwithmythoughts,euct6o,[removed],history,The first transgender surgeries question inspired by The Danish Girl
258,BusbyBusby,eucqob,[removed],history,What is it about Linear A that makes it so difficult to decipher
259,ImRealFunAtParties,eucet6,[removed],history,How do you choose a reliable translated source that puts things into context
261,MSUsparty29,eubl67,[removed],history,Kobe Bryant dead
262,Leosown,eubhx8,[removed],history,How were Asians treated during segregation and slavery 
263,bapechimpanzee,eub71t,[removed],history,Found a cool site coat of arms like site
265,laxbruh12312,eualzf,[removed],history,Castro and the Mariel boatlift
266,DataGuru314,eua5jb,[removed],history,Why is it so uncommon for US Presidents to choose not to run for a second term
267,VerySecretCactus,eua0xg,[removed],history,Are there examples of books that were read by essentially every educated person in past centuries despite being rare to hear about today
269,tobeconfirmed_1,eu8hh0,[removed],history,Opinions on Giuseppe Mazzini and Karl Marx
270,OlSmokeyZap,eu8dpt,[removed],history,Documentaries or Books on US occupation of Japan
272,American_Ceasar,eu8a3r,[removed],history,How effective was the royal Hungarian army during the Second World War
273,herschkitsch,eu7j71,[removed],history,The First Australian Native Captured By Imperialists
274,worldwidescrotes,eu7ajr,[removed],history,Help me remember the name of Bilshevik who regretted his role in the Red Terror
275,JonathanSwiftest,eu78pj,[removed],history,What were the wildest events to happen near the White House
276,RandyLiddell,eu689e,[removed],history,Book recommendations on the early medieval period in northern Italy
277,Sergey_Romanov,eu65a2,[removed],history,Remember the 11 million Why an inflated victims tally irks Holocaust historians
278,Jluke223,eu5wq4,[removed],history,What was the name of the ship in which the first colonists arrived
279,laszlo92,eu5i3s,[removed],history,Question about the title Earl
280,20poolja,eu5cp7,[removed],history,Who took the Napalm Girl video
281,darthcactus2100,eu4uff,[removed],history,Can someone explain why Bletchley Park went through all that trouble if Juan Pugol Garcia had access to an Enigma machine
282,dhl55,eu46z2,[removed],history,Romans vs Italians
283,Lizards-Rule,eu414e,[removed],history,Best Hitler Biography
286,Godly_Quanta,eu36jj,[removed],history,Questionable accuracy in Netflix show Rise Of Empires Ottoman
288,_Sunny--,eu2qmz,[removed],history,Listening back to Nixon and Kennedys debates one of the big talking points was on Quemoy and Matsu Why has this topic faded into obscurity in the decades since
289,ThePoarter,eu2g64,[removed],history,Im a free man of colour in Haiti a few years prior to the revolution What is my status and how am I treated
290,Af203,eu24fz,[removed],history,Do we have historical accounts of micropenises
291,GGSDP22,eu1s2s,[removed],history,Mao Zedong fact check
292,YoungSaltine1,eu1qcd,[removed],history,Which empire treated polish people the best
294,JamieThor101,eu130j,[removed],history,I need an honest website to buy ww2 or ww1 antiques uniformsmedals and flags
297,lucasmaciel1871,eu0sdm,[removed],history,Books on the history of the bourgeoisie and of the proletariat
298,labink,eu0p4g,[removed],history,The History of the Soviet experience in Afghanistan
299,rudz97,eu0p1b,[removed],history,Are there really more incels today than there were when traditional marriage was more of a thing
300,Smileinstead,eu0lot,[removed],history,Any suggestions for a book that picks up where Cleopatra ends
301,wozer,eu05le,[removed],history,When early modern painters were painting biblical scenes were they aware that their paintings were unrealistic or did they think that ancient Palestine looked just like central Europe
302,Voldylock,eu04a0,[removed],history,Why did the US ultimately go to war with Vietnam
303,TheCheeser9,etzxe4,[removed],history,Why did Czarist Russia only want male rulers
304,Stone-Record,etzuhz,[removed],history,A question on seasonal shifts
306,unkn0wnbyte,etz198,[removed],history,Did the Moors ever occupy Israel
309,IAmTheGlazed,etykab,[removed],history,What was the relationship like between Elizabeth I and Henry VIII
310,claudedeyarmond,etyk5j,[removed],history,Napoleon was to have said History is a set of lies agreed upon For people that reject the history accepted by most of the world what is the history they believe in
312,YuINOPE,etyg21,[removed],history,Question from a person who is ignorant on UK politics why was Margaret thatcher hated
313,KaganY,etyb9w,[removed],history,I couldnt find the answer of this enigma could you help
314,thewallabee,ety5xl,[removed],history,Discuss the portrayal of Viking society in the 1958 film The Vikings How faithfully does the film reflect the society portrayed in Ragnars Sagaand by Saxo Grammaticus
315,Tunago_,etxgqk,[removed],history,Whats the real story behind the Magna Carta
316,chaotic-struggle,etxbyj,[removed],history,Colonial Britain in the British Education system
317,ehef,etwk1g,[removed],history,What is the illness known as African experience
318,HumanityShould3nd,etwiwv,[removed],history,What was Concrete Ships importance to help in ww2
319,paddyw23,etwfjr,[removed],history,How did dick Cheney and donald rumsfeld have so much influence in the bush administration
321,HumanityShould3nd,etw6li,[removed],history,What was the Concrete Ships used for in WW2
323,Drabbestplayer,etvyfx,[removed],history,According to a study done by the United States Holocaust Memorial Museum 11 million others were murdered by the Nazis
324,paddyw23,etvxeg,[removed],history,How accurate is VICE with explaining how dick Cheney and donald Rumsfeld had unlimited access to bush influenced major decisions and were CCd on all emails How did they have people in every department
325,AlpineMilch,etvp88,[removed],history,After Mehmed The Conquerer took Constantinople he was nicknamed Kayseri Rum which means the ruler of the Romans In German Kaiser means emperor or head of state is there possibility this similarity in name is not just coincidence 
326,didi_digger,etvlkb,[removed],history,What was George V reaction to the assassination of Tsar Nicholas II
327,Drabbestplayer,etvjgx,[removed],history,According to a study done by the United States Holocaust Memorial Museum 11 million others were murdered by the Nazis
328,Drabbestplayer,etvegj,[removed],history,According to an academic study done by the United States Holocaust Memorial Museum 11 million others murdered by the Nazis
330,Penguin1of0,etv4s8,[removed],history,Did the United States of America have some influence in the Holocaust
332,Drabbestplayer,eturyh,[removed],history,We should never forget the 11 million others murdered by the Nazis its 11 million others not 5 million others According to the United States Holocaust Memorial Museum
334,OkFile1,etulkk,[removed],history,Lhistoire des berbers
336,Pashahlis,etuanv,[removed],history,Are there cases of generals or admirals fucking up and being demoted as a consequence but being able to climb their way back up again
337,Stralau,etu97l,[removed],history,Switzerland was considered near impregnable by modern armies in the 20th Century Why then was it relatively simple for early modern and pre modern armies like Napoleon and the Romans to conquer it
339,Author1999,ettztz,[removed],history,What was the relationship between Sri Lanka and the Tamil people of southern India between 500 BC to 500 AD Did they influence each other or engage in wars
340,oi1233,ettvxf,[removed],history,Real reason of Vietnam war
341,KathyDroronoa,ettrcb,[removed],history,Where to start in history
342,WolfOfDeribasovskaya,ettkdo,[removed],history,Can someone help to confirm authenticity of this SA dagger please
343,Author1999,ettgow,[removed],history,What was the relationship between Sri Lanka and the Tamil people of southern India between 500 BC to 500 AD Did they influence each other or engage in wars
344,oi1233,ettgoe,[removed],history,Real reason of the Vietnam war
345,darthcactus2100,ettd6p,[removed],history,Why did Bletchley Park have such a hard time with the Enigma code if Juan Pugol Garcia had access to an Enigma machine
346,darthcactus2100,ett7a3,[removed],history,Garbo Enigma and Bletchley Park
347,AnakinWayneII,ets6y8,[removed],history,Question about Barbary lions
348,jamkid23,etrxcz,[removed],history,How do compound bows compare to bows in the Middle Ages and Antiquity If those ancient armies got compound bows would they have a massive advantage over contemporary forces
349,Red-Right,etrwv6,[removed],history,Gross output of US industries first collected
350,lemonided,etrw7k,[removed],history,Books about the Spanish civil war
351,petyrlabenov,etrw2o,[removed],history,Question about the Setif Massacre
352,FredrickVonAckermann,etro4m,[removed],history,How did the word comrade become associated with communism
353,lemonided,etrlxx,[removed],history,Books about Spanish civil war
354,EdHerzriesig,etrbzr,[removed],history,Are there any records of famous allied commanders/generals loosing family members during ww2 And what was the average age of the ones in charge
356,redHEP88,etr3fc,[removed],history,What cultures did the nazis actually kill
357,JoeyBosa,etqwng,[removed],history,Im watching Netflixs Rise of Empires Ottoman and the narrator keeps mentioning that 23 armies tried to take Constantinople and failed prior to the Ottomans Isnt this incorrect due to the fact that the Fourth Crusade resulted in Constantinople effectively being captured
358,bobifox,etqrup,[removed],history,Why chemical warfare was not part of WWII
361,bobifox,etqnrq,[removed],history,Why chemical warfare was not part of WWll
364,PacoPowers,etq4vc,[removed],history,What is a good game for learning about historical events
365,PacoPowers,etq16u,[removed],history,Looking for game to teach me history
366,Veganboi758,etpyhc,[removed],history,Who has suffered the most
367,MP0991,etpwyv,[removed],history,Old nazi Germany film translations
369,basileus19b,etpg2j,[removed],history,Rags to riches stories similar to that of Genghis Khan
371,kilaxram,etp6xe,[removed],history,How was the daily life of a Byzantine person during winter
377,kilaxram,eton1m,[removed],history,How was the daily life of an average Byzantine person during winter How similar was it to someone living in Western Europe
378,sansoleth,etobpd,[removed],history,Trainee history teacher attempting to not be boring
379,RandomlyArbitraryMan,etn9lj,[removed],history,Iloilo and everything about it before its decline is such an interesting piece of Philippine history
381,SkippyMGee,etmiy6,[removed],history,When did German intellectuals and policy makers start viewing Eastern Europe as a territory ripe for annexation
382,aevictory,etmat3,[removed],history,Why didnt the founding fathers have the Constitution typeset and printed
383,throwawayforadayor3,etm13h,[removed],history,Did any Confederate states outlaw slavery before the war ended
384,Wolf_110,etlxuz,[removed],history,How bloody was the American Revolution
385,pinoyathletics,etlw8s,[removed],history,Nazis murdered a quarter of Europes Roma but history still overlooks this genocide
386,throwawayforadayor3,etlw3p,[removed],history,Did any Confederate states outlaw slavery before the war ended
387,Jagger2020,etloo5,[removed],history,Best books on the Hatfield and McCoy Feud
389,Geoffistopholes,etld9d,[removed],history,Environment and whatnot
390,_RoyalMajesty_,etld53,[removed],history,When did AngloSaxon Names Die Out
392,sonofdarknesslol,etkyka,[removed],history,Did ancients know what inbreeding did
393,iMiscellaneous2,etkudp,[removed],history,Does ancient Mythology have official names
395,biochemmolgen,etk5hj,[removed],history,Vercingetorix
396,mjk19871,etjxy2,[removed],history,Why is the replenishment of the eastern US forests not recognized
397,shade_plant,etjlt6,[removed],history,Preprohibition alcohol consumption and social context for start of temperance movement
398,JoeyBosa,etjibf,[removed],history,Would many of the Turkish troops who fought during the Turkish War of Independence 19191922 have been battle hardened soldiers by the time this conflict came around
399,genericusername3113,etin7n,[removed],history,How was it possible for Lt George Washington De Long to prevent mutiny on his March across the ice during the US Polar Expedition
400,sdloa63,etii57,[removed],history,Is it true that in ancient history leaders tended to only record their successes and not their failures
402,rham-fero97,ethq68,[removed],history,Communication and human societies
403,RCrowley_49,ethahv,[removed],history,Did all Nazisincluding those that were forced to or were just fighting get charged and face war crime trials
404,Mikkkelodeon,eth1sf,[removed],history,Were the Germans really THE bad guys at WWI or they were just an army going to war
405,lewis150042,etgvfi,[removed],history,What time in Russian history do you think it would be scarier to be in The toppling of the Tsar or the collapse of the USSR
406,KavyenMoore,etg8rr,[removed],history,Historians speak of a First and Second British Empire but why isnt the first one simply known as the English Empire
407,panthenap,etfucx,[removed],history,Had Kennedy lived would we have gotten so involved in Vietnam
408,SerpentCrayfish,etfcm1,[removed],history,Books on ottoman conquests in the balkans
409,nada_rat,etexkd,[removed],history,Arapaho clothing is this allowed
410,SirFeatherbottom,etel1m,[removed],history,Does anyone know the details of this duel
411,Damien-23,etej6e,[removed],history,Why werent revolutionaries executed
412,yztla,eteihe,[removed],history,Why does orban polish the bear during the siege of constantinople
413,SirFeatherbottom,etefq5,[removed],history,Trying to remember the details of an unusual duel in the UK
415,purpledumbbell,ete9zg,[removed],history,Were historical people with bad vision essentially SOL before glasses existed
417,Mike1123567,etdtk7,[removed],history,Drug use during the vietnam war
418,MARTINELECA,etdsls,[removed],history,Why werent the Allied armies better prepared to withstand the Chinese offensive in Korea
419,JackC1126,etd8hf,[removed],history,The Doomsday Clock has been reset to only 100 seconds to midnight closer than ever before Are we really closer to the apocalypse than any other point in history
421,JackC1126,etd379,[removed],history,The Doomsday Clock was recently reset to only 100 seconds from midnight closer than ever before Are we really closer to the apocalypse than any other time in history Why or Why not
423,MARTINELECA,etcww3,[removed],history,Why werent the Allied armies better prepared to withstand the Chinese offensive in Korea
424,Smoothcat262,etcvd8,[removed],history,Are there any groups of Native Americans that still attempt to live their cultures more traditional lifestyle
425,JotaTaylor,etctuk,[removed],history,References on Neros rule
429,Xazzur,etc1ln,[removed],history,Was the west against the unification of Germany
431,JNREEEE18,etbs18,[removed],history,Which country do you regard as having the greatest influence in the enlightenment and who in your opinion is one of the most important figures
436,gmminare,etakjn,[removed],history,How did Christianity become so prominent in Rome in just a few decades
437,Leftlightreftright,eta63i,[removed],history,Is acne a modern thing Are there any records of people complaining about acne and did ancient humans have them
438,MercutioElessar,et9xhg,[removed],history,We know that John Little or Little John as he is called in numerous works really existed due to reports of him being a member of the Coterel gang in 1318 But what proof do we have that a single Robin Hood existed who fits the description
439,Leftlightreftright,et9xag,[removed],history,Is acne a modern thing Are there any records of people complaining about acne and did ancient humans have them
440,Leftlightreftright,et9lv4,[removed],history,Is acne a modern thing Are there any records of people complaining about acne and did ancient humans have them
443,JoeyBosa,et96el,[removed],history,Would many of the Turkish troops fighting during the Turkish War of Independence 19191922 have been battle hardened soldiers by the time this conflict came around
445,justinitforthesci,et8nyi,[removed],history,An interesting read about the H1N1 influenza pandemic of 1918
447,Dippypiece,et873v,[removed],history,Germans acquired a bridge head on the Easten side of the Volga river August 1942
448,XlntX,et858f,[removed],history,Need help
449,edgyprussian,et7tqj,[removed],history,Cold War considerations of NonAggression Pact
450,tyguy99925,et7q9x,[removed],history,Question  Is there a modern day equivalent to the counties involved in the American Revolutionary War 1765  1783 in terms of the size of army and its funding
452,veve87,et7173,[removed],history,How do i get more interested in history
453,SirKristopher,et6h67,[removed],history,Bronze to Iron to Nukes
454,Crystal_Spammer,et680p,[removed],history,Did people really get to work way less in 19501980s than they do now
455,Sol33t303,et5yze,[removed],history,What were the worst wars that were started purely out of hatred/racism/etc
456,grimsituation6,et5c8w,[removed],history,Moses story actually a historical reflection of antisemitism
457,biffsflavourtown,et5c04,[removed],history,Communism vs Nazism
458,seansman15,et56ns,[removed],history,Gems raising in price during/preceding war time
463,julianah11,et3ry6,[removed],history,Innovation Medical
465,Tionos,et3k4b,[removed],history,People know war is coming
466,R00274H,et3dtu,[removed],history,Who were some notable equestrians in the Roman military
467,gmminare,et2wpg,[removed],history,How did Christianity become so prominent in Rome in just a few decades
468,pallavnayak,et219a,[removed],history,The mummy speaks
470,nina-de5a7,et12rz,[removed],history,Ideas for resources especially books and uses of plants in Aztec mythology Im mostly interested in the Agave plant
471,Leumas057,et11qy,[removed],history,QUESTION Joan of Arc
472,rbuen4455,et11ly,[removed],history,During the Second SinoJapanese war how were Japanese able to occupy Shanxi province but not Fujian or beyond Shanxi
473,nina-de5a7,et0vey,[removed],history,Aztec Mythology
474,Jonathan3628,et0lhs,[removed],history,Roman Economic History
476,Red-Right,eszzyz,[removed],history,US machinery output
477,GentelTree,eszem0,[removed],history,How was it to live under the Swedish Empire
479,GentelTree,esz94t,[removed],history,How was it to live while the Swedish Empire Lasted
480,thanonofblank,esyq71,[removed],history,books on making making historic inks
481,eldestsauce,esy7k9,[removed],history,When was the sluttiest period in history
482,montezuma300,esy55l,[removed],history,Old Norse judicial system of throwing objects at the defendant
485,EpicnessYeet,esx4vp,[removed],history,Why Didnt The Roman Empire Expand Onto Scotland And Ireland When They Reached Britain
486,Sectalam,esx1ky,[removed],history,What was the Greek attitude towards the Romans
487,NikoFromFin,esww7y,[removed],history,Woods used in ancient Egyptian musical instruments
489,gewoondaniel,eswdpl,[removed],history,How did England and France became friends
490,Boocams,esw9py,[removed],history,The story of a former porn actor  how life changes after a career
491,Comsicwastaken,esvzlp,[removed],history,What are some negatives of Zheng He the Ming Dynasty voyager/explorer
493,Der__Golem,esvj4e,[removed],history,Can someone explain me what is the dagger on the left and the sword on the right
495,YNW_Just_a_Webit,esvay9,[removed],history,Why did chariot races and gladiatorial games in ancient Rome rise the most in popularity compared to other ancient games
498,Mg5201998-,esv3l0,[removed],history,Has ancient Egypt or Ancient Greece contributed more to modern society
499,robwords,esuyp6,[removed],history,Unanswered questions about the Phoenician city of Malaka now Mlaga Spain and its physical change in coastline
501,NikoFromFin,esut11,[removed],history,What trees were wooden Mesopotamian instruments made out of
503,Mg5201998-,esulwd,[removed],history,Ancient Egypt vs Ancient Greece
505,tottenhamwhite1608,esuij4,[removed],history,Why did Habsburg/Austrian Empire had such a weak army through centuries and how did they manage to build and hold large empire despite weakness of its armies
510,Stayinschool-tty,estmm0,[removed],history,In the 1400s1700s or just about how many failed pregnancies or disinformed babies were due to poor hygiene versus bad genetics/ breeding
512,MightyMike99,esskef,[removed],history,Interregnum 12451273 HRE
514,Booksaretooexpensive,esrb45,[removed],history,Is it a historically accurate claim that collapsing and corrupt socities tend to enact many more laws than they did in their health
518,Crusaders1992,espjgo,[removed],history,Medieval Battles
519,ureeld,espd4i,[removed],history,Did the German populace know about the Holocaust during WWII When did they become aware of it and what was the public reaction
521,SUBUTAl,esox7x,[removed],history,Are there any eyewitness accounts of the German invasion of Belgium in 1914
522,Sir_Featherz,esonar,[removed],history,So I was doing research on the transcontinental railroads in the US and I ran into an issue about the naming of the Act of 1862
523,Few_Common,esnrjf,[removed],history,Nnn
524,dfrankow,esn8tq,[removed],history,Why could George Washington and the revolutionaries not stop Governor Tryon in New York Harbor
525,Boss_Status1,esmxqs,[removed],history,Are there any notable prophets in history that grew a following but failed to truly form a religion
526,got_erps,esml57,[removed],history,Did other large cities in the Roman Empire adopt Senates
527,random-trash-acount,esmc9s,[removed],history,Did Tibet fight in world war 2
529,random-trash-acount,esm22y,[removed],history,Did Tibet fight in ww2
531,AskJarule,eslq9l,[removed],history,What did the 11 dash line by the republic of china entail
532,JayMH33,eslngi,[removed],history,HELP
533,Trevor319_,eslm6k,[removed],history,Was using nukes the right option on Japan
534,marcassh1,eslc30,[removed],history,Did early American settlers know about the Spaniards in the West
535,dorianisabitch,eskljs,[removed],history,Need help identifying someone in a picture
536,st72583,eskj0v,[removed],history,Indigenous People of the US and Australia
537,foiceemartelo,eskcas,[removed],history,Ancient Greece Book recommendation for the period between the Peloponnesian war and the death of Alexander the Great
538,P1nkSt1nk,eskc0t,[removed],history,Cold War in comparison with German Colonialism Wilhelm II and Bismarck
